{"schemaVersion":"1.0","reportId":"f88424d04a8e29b5e7c118178906366bb8faff91e04fd70e75c4316c02932ecb","sessionId":"advisory-session","ledgerTraceId":"advisory-trace","advisorySourceDigest":"f5ad97be0cedf8a3ea1a85305f22d907af057a5183fa42943f95f21173f368d7","generatedAt":"1970-01-01T00:00:00.0000000Z","divergences":[{"obligationId":"o1","ledgerStatus":"satisfied","advisoryStatus":"satisfied","diverged":false},{"obligationId":"o2","ledgerStatus":"satisfied","advisoryStatus":"satisfied","diverged":false}],"rollup":{"totalObligations":2,"divergentCount":0,"allConverged":true}}
