{"schemaVersion":"1.0","reportId":"171a965e6db47c6b65fd7685ca814980a8cc5e2fa5f411931de892ba079d964d","sessionId":"advisory-session","ledgerTraceId":"advisory-trace","advisorySourceDigest":"f5ad97be0cedf8a3ea1a85305f22d907af057a5183fa42943f95f21173f368d7","generatedAt":"1970-01-01T00:00:00.0000000Z","divergences":[{"obligationId":"o1","ledgerStatus":"open","advisoryStatus":"satisfied","diverged":true},{"obligationId":"o2","ledgerStatus":"satisfied","advisoryStatus":"satisfied","diverged":false}],"rollup":{"totalObligations":2,"divergentCount":1,"allConverged":false}}
